{"authority_id":"ovito-release-source-docs-3-15-5","blockers":[{"code":"doc.body.bytes.external","description":"Exact documentation source and asset bodies and per-page content hashes are not retained.","dimension":"inventory"}],"contract_name":"official-corpus-manifest","corpus_id":"ovito-atomistic-analysis-ovito-docs-official-corpus","discovery":{"authority_revision":"23acf8add70f1949b7fb4e32f6e0205540cf29b63d79dfd4e4b9bede632a1412","authority_root":"https://gitlab.com/stuko/ovito/-/tree/0b2cdccef7452bf28212e15daf9df2dc7a545bcc/","inventory":{"content_mode":"metadata-only","identity":{"bytes":15283,"sha256":"23acf8add70f1949b7fb4e32f6e0205540cf29b63d79dfd4e4b9bede632a1412"},"locator":"https://gitlab.com/stuko/ovito/-/tree/0b2cdccef7452bf28212e15daf9df2dc7a545bcc/doc"},"inventory_format":"official-document-source-catalog-1.1","inventory_scope":"upstream-universe","method":"manual-inventory","processor":{"assurance_mode":"unverified","attestation_id":null,"configuration_ref":null,"dependency_lock_ref":null,"deterministic":true,"implementation_ref":null,"input_sha256":"23acf8add70f1949b7fb4e32f6e0205540cf29b63d79dfd4e4b9bede632a1412","output_sha256":"f6021c12784301ad208411f1a2f3d26bd5a7af807e480e4e261517a54314b909","processor_id":"official-document-pack-enumerator","processor_version":"1.0"},"upstream_universe_complete":true},"limitations":["Inventory and source identities are projected as technical artifacts only.","The exact doc-tree inventory does not establish body coverage, generated-reference closure, edition/entitlement identity, package artifact identity, native execution, modifier numerical validation, rendering determinism, or scientific acceptance.","The exact v3.15.5 documentation tree and exact PyPI release metadata/artifact digests are inventoried; documentation bodies, generated references, distribution artifacts, imported bytes, desktop applications, entitlement, and user artifacts remain external.","The inventory identity binds the exact pre-migration catalog bytes as migration metadata; it does not identify any upstream document body."],"producer":{"generated_utc":"2026-07-24T00:00:00Z","skill_id":"ovito-atomistic-analysis","skill_version":"1.0","tool_id":"official-document-pack-builder","tool_version":"1.0"},"provider_id":"ovito","schema_version":"1.1","source_inventory":{"ovito-exact-document-tree-inventory":{"disposition":"included","loss_ids":["document-bodies-not-retained","documentation-build-not-replayed","edition-and-pro-entitlement-external","third-party-and-artifact-provenance-closure-external"],"source_identity":{"content_mode":"external-content","locator":"https://gitlab.com/stuko/ovito/-/tree/0b2cdccef7452bf28212e15daf9df2dc7a545bcc/doc","receipt":{"raw_bytes":78789,"raw_sha256":"3d726912303ef6bf08be4c987daf7b49dfc5d230de6159a94783412032b6e285","retrieval_method":"git-object","retrieved_utc":"2026-07-24T00:00:00Z"}},"source_kind":"index","subject_ids":["analysis.atomic-strain","analysis.common-neighbor","analysis.coordination-rdf","analysis.dislocation-extraction","analysis.displacement-vectors","analysis.polyhedral-template-matching","analysis.time-averaging","analysis.wigner-seitz","api.data-collection-cell","api.export-file","api.file-source-load","api.import-file","api.pipeline-compute","export.tables-trajectories","input.xyz-extxyz","documentation.source-component-identity","mapping.particle-identifiers-order","mapping.pbc-lattice-units","provider.basic-desktop","provider.edition-identity-separation","provider.pro-desktop","provider.python-module","rendering.static-animation","validation.visual-numerical-boundary","workflow.pipeline-order"],"title":"OVITO v3.15.5 complete documentation-tree metadata inventory"}},"status":"blocked","version_scope":{"kind":"exact","retrieved_utc":null,"snapshot_identity":null,"value":"3.15.5"}}
