{"authority_id":"rdkit-release-source-docs-2026-03-4","blockers":[{"code":"doc.body.bytes.external","description":"Official document bodies and per-page content hashes are not retained, so provider-required subjects remain blocked.","dimension":"inventory"}],"contract_name":"official-corpus-manifest","corpus_id":"dft-structure-preparation-rdkit-docs-official-corpus","discovery":{"authority_revision":"0195c49cf2f638808c84d15ea5159534eda1354c5af19bb8f1d835718ec98f3e","authority_root":"https://github.com/rdkit/rdkit/tree/","inventory":{"content_mode":"metadata-only","identity":{"bytes":5387,"sha256":"0195c49cf2f638808c84d15ea5159534eda1354c5af19bb8f1d835718ec98f3e"},"locator":"https://github.com/rdkit/rdkit/tree/Release_2026_03_4"},"inventory_format":"official-document-source-catalog-1.1","inventory_scope":"upstream-universe","method":"manual-inventory","processor":{"assurance_mode":"unverified","attestation_id":null,"configuration_ref":null,"dependency_lock_ref":null,"deterministic":true,"implementation_ref":null,"input_sha256":"0195c49cf2f638808c84d15ea5159534eda1354c5af19bb8f1d835718ec98f3e","output_sha256":"ea3a0486525b436679259ef5087a7d03d17162dabeb9a05727732703fd15de90","processor_id":"official-document-pack-enumerator","processor_version":"1.0"},"upstream_universe_complete":true},"limitations":["Exact release Git-tree path and object identities are retained without official document bodies or generated rendered pages.","External raw identity is the SHA-256 of canonical sorted git ls-tree -r receipt lines '<mode> <object_type> <object_id>\\t<path>\\n' for every inventory entry; the local inventory JSON is metadata evidence only and contains no official document body bytes.","Inventory and source identities are projected as technical artifacts only.","The inventory identity binds the exact pre-migration catalog bytes as migration metadata; it does not identify any upstream document body.","This metadata inventory proves the bounded exact tree and path universe only; it does not prove rendered documentation completeness or provider behavior."],"producer":{"generated_utc":"2026-07-24T00:00:00Z","skill_id":"dft-structure-preparation","skill_version":"1.0","tool_id":"official-document-pack-builder","tool_version":"1.0"},"provider_id":"rdkit","schema_version":"1.1","source_inventory":{"rdkit-exact-document-tree-inventory":{"disposition":"included","loss_ids":["document-bodies-not-retained","rendered-build-not-replayed"],"source_identity":{"content_mode":"external-content","locator":"https://github.com/rdkit/rdkit/tree/Release_2026_03_4","receipt":{"raw_bytes":55098,"raw_sha256":"ab204a184dc3d78644a9cb0caf8c239630a3fdf5330a6658bdc5a91624bc0294","retrieval_method":"git-object","retrieved_utc":"2026-07-23T20:17:38Z"}},"source_kind":"index","subject_ids":["rdkit-molecule-parse","rdkit-etkdg-conformers","rdkit-molfile-write"],"title":"Exact release documentation-tree metadata inventory"}},"status":"blocked","version_scope":{"kind":"exact","retrieved_utc":null,"snapshot_identity":null,"value":"2026.03.4"}}
