{"authority_id":"lobster-wiley-method-literature","blockers":[],"contract_name":"official-corpus-manifest","corpus_id":"lobster-bonding-analysis-lobster-wiley-method-literature-official-corpus","discovery":{"authority_revision":"a5104f3350cf2953c0c587f332b1309cfdbf46593b06b63d35a2622a8ac01ca9","authority_root":"https://doi.org/10.1002/","inventory":{"content_mode":"metadata-only","identity":{"bytes":9315,"sha256":"a5104f3350cf2953c0c587f332b1309cfdbf46593b06b63d35a2622a8ac01ca9"},"locator":"https://doi.org/10.1002/jcc.23424"},"inventory_format":"official-document-source-catalog-1.1","inventory_scope":"bounded-authority-subset","method":"manual-inventory","processor":{"assurance_mode":"unverified","attestation_id":null,"configuration_ref":null,"dependency_lock_ref":null,"deterministic":true,"implementation_ref":null,"input_sha256":"a5104f3350cf2953c0c587f332b1309cfdbf46593b06b63d35a2622a8ac01ca9","output_sha256":"5e439a047e8de327f271d57219112a3b9a55cfb39228f02380e772b27023ed9c","processor_id":"official-document-pack-enumerator","processor_version":"1.0"},"upstream_universe_complete":false},"limitations":["Inventory and source identities are projected as technical artifacts only.","No central query-policy change is requested by this seed.","Projection, population, automation, and file-role claims still require claim-specific paper review; the DOI metadata alone supplies identity rather than scientific content.","Publication text, figures, tables, supporting information, scientific interpretation, and native LOBSTER payloads remain external.","The inventory identity binds the exact pre-migration catalog bytes as migration metadata; it does not identify any upstream document body.","The literature spans method generations and cannot be promoted to an exact LOBSTER 5.1.1 operational contract.","The records identify provider-required primary and workflow literature but do not store publication text, figures, tables, supporting information, or native LOBSTER payloads.","The two active inputs cover only metadata identities for seven provider-required ACS and Wiley publications."],"producer":{"generated_utc":"2026-07-24T00:00:00Z","skill_id":"lobster-bonding-analysis","skill_version":"1.0","tool_id":"official-document-pack-builder","tool_version":"1.0"},"provider_id":"wiley","schema_version":"1.1","source_inventory":{"lobster-automation-2022-doi":{"disposition":"included","loss_ids":["lobster-wiley-publication-bodies-external"],"source_identity":{"content_mode":"external-content","locator":"https://doi.org/10.1002/cplu.202200123","receipt":{"raw_bytes":15330,"raw_sha256":"e8e8aeff7abb3c2a9b27da2b6b0c6ea1c771ceb1184837094e4ca28972f56c40","retrieval_method":"https-get","retrieved_utc":"2026-07-23T19:46:29Z"}},"source_kind":"api-record","subject_ids":["lobster-framework-capability"],"title":"Automated bonding analysis with COHP, 2022"},"lobster-framework-2013-doi":{"disposition":"included","loss_ids":["lobster-wiley-publication-bodies-external"],"source_identity":{"content_mode":"external-content","locator":"https://doi.org/10.1002/jcc.23424","receipt":{"raw_bytes":15026,"raw_sha256":"90cd5010c2ee4d640d944b82d2065d3962ef31886079f06e7e8d4799fdb81207","retrieval_method":"https-get","retrieved_utc":"2026-07-23T19:46:29Z"}},"source_kind":"api-record","subject_ids":["lobster-framework-capability"],"title":"Analytic projection and bonding analysis framework, 2013"},"lobster-population-2020-doi":{"disposition":"included","loss_ids":["lobster-wiley-publication-bodies-external"],"source_identity":{"content_mode":"external-content","locator":"https://doi.org/10.1002/jcc.26353","receipt":{"raw_bytes":11819,"raw_sha256":"1cc1dfa0be45c253961120a9734f935d1a9e1233ebeee0fdb01696c5e7509f0b","retrieval_method":"https-get","retrieved_utc":"2026-07-23T19:46:29Z"}},"source_kind":"api-record","subject_ids":["lobster-framework-capability"],"title":"LOBSTER local projections and population analysis, 2020"},"lobster-tool-2016-doi":{"disposition":"included","loss_ids":["lobster-wiley-publication-bodies-external"],"source_identity":{"content_mode":"external-content","locator":"https://doi.org/10.1002/jcc.24300","receipt":{"raw_bytes":10213,"raw_sha256":"24dc780a1ec0f6e5c30790f2a68b8308e934623b5933acc112e8e1839ab7cabe","retrieval_method":"https-get","retrieved_utc":"2026-07-23T19:46:29Z"}},"source_kind":"api-record","subject_ids":["lobster-framework-capability"],"title":"LOBSTER bonding extraction tool, 2016"}},"status":"partial","version_scope":{"kind":"unversioned","retrieved_utc":null,"snapshot_identity":null,"value":null}}
