{"authority_id":"json-schema-standard-2020-12","blockers":[{"code":"jsonschema.bodies.external","description":"The metadata-only receipts do not provide offline specification bodies or an attested exact-content resolver.","dimension":"inventory"}],"contract_name":"official-corpus-manifest","corpus_id":"dft-project-orchestrator-json-schema-2020-12-official-corpus","discovery":{"authority_revision":"6ba79a596efc4f50086cc97258660b839b92e9928c1df3795cacf02d3c009ad6","authority_root":"https://json-schema.org/draft/2020-12/","inventory":{"content_mode":"metadata-only","identity":{"bytes":4443,"sha256":"6ba79a596efc4f50086cc97258660b839b92e9928c1df3795cacf02d3c009ad6"},"locator":"https://json-schema.org/draft/2020-12/json-schema-core.html"},"inventory_format":"official-document-source-catalog-1.1","inventory_scope":"bounded-authority-subset","method":"manual-inventory","processor":{"assurance_mode":"unverified","attestation_id":null,"configuration_ref":null,"dependency_lock_ref":null,"deterministic":true,"implementation_ref":null,"input_sha256":"6ba79a596efc4f50086cc97258660b839b92e9928c1df3795cacf02d3c009ad6","output_sha256":"9206aad0dda31d3cd89504c644f729728d350f1ebfcb15da5eece5af9fd45f61","processor_id":"official-document-pack-enumerator","processor_version":"1.0"},"upstream_universe_complete":false},"limitations":["Inventory and source identities are projected as technical artifacts only.","JSON Schema provenance is limited to dialect and validation-vocabulary semantics; it does not prove the candidate's hand-written checks are a conforming JSON Schema implementation.","No conformance claim is made for the candidate's hand-written validators.","The inventory identity binds the exact pre-migration catalog bytes as migration metadata; it does not identify any upstream document body.","The two pages cover only the dialect/core and validation-vocabulary scope named by this Skill.","This pack is metadata-only and embeds neither repository contract bodies nor JSON Schema specification bodies."],"producer":{"generated_utc":"2026-07-24T00:00:00Z","skill_id":"dft-project-orchestrator","skill_version":"1.0","tool_id":"official-document-pack-builder","tool_version":"1.0"},"provider_id":"json-schema","schema_version":"1.1","source_inventory":{"json-schema-core-2020-12":{"disposition":"included","loss_ids":["json-schema-bodies-external"],"source_identity":{"content_mode":"external-content","locator":"https://json-schema.org/draft/2020-12/json-schema-core.html","receipt":{"raw_bytes":342564,"raw_sha256":"f8b080be1d8b8eb318ea712c7bad4bf83734b3ee81379baf0c0290292ab5e652","retrieval_method":"https-get","retrieved_utc":"2026-07-23T20:02:38Z"}},"source_kind":"reference-page","subject_ids":["jsonschema.draft202012.dialect"],"title":"JSON Schema Core 2020-12"},"json-schema-specification-landing":{"disposition":"excluded","rationale":"The landing page is not used as a substitute for the separately pinned Core and Validation specifications.","reason_code":"navigation-only","source_identity":{"content_mode":"excluded","inventory_entry_identity":{"bytes":252,"sha256":"fec72a59f22b7b38a48432695539b2b60b58a71e507dffcb3a204f52178d66e5"},"locator":"https://json-schema.org/specification"},"source_kind":"other","title":"JSON Schema specification landing page"},"json-schema-validation-2020-12":{"disposition":"included","loss_ids":["json-schema-bodies-external"],"source_identity":{"content_mode":"external-content","locator":"https://json-schema.org/draft/2020-12/json-schema-validation.html","receipt":{"raw_bytes":169423,"raw_sha256":"ad91ab6839d7b1f1209c496663c90e406a4530fe333d3e7aade0968e8c590f2f","retrieval_method":"https-get","retrieved_utc":"2026-07-23T20:02:38Z"}},"source_kind":"reference-page","subject_ids":["jsonschema.draft202012.validation-vocabulary"],"title":"JSON Schema Validation 2020-12"}},"status":"blocked","version_scope":{"kind":"exact","retrieved_utc":null,"snapshot_identity":null,"value":"2020-12"}}
