{"authority_id":"gromacs-release-source-docs-2026-3","blockers":[{"code":"doc.body.bytes.external","description":"Official 2026.3 document bodies and per-page content hashes are not retained.","dimension":"inventory"}],"contract_name":"official-corpus-manifest","corpus_id":"gromacs-rigorous-simulations-gromacs-docs-official-corpus","discovery":{"authority_revision":"10e748c7da6a95637d350c023e906e20ab51074a1211cde5f75cac42d36afb43","authority_root":"https://github.com/gromacs/gromacs/tree/v2026.3/","inventory":{"content_mode":"metadata-only","identity":{"bytes":31490,"sha256":"10e748c7da6a95637d350c023e906e20ab51074a1211cde5f75cac42d36afb43"},"locator":"https://github.com/gromacs/gromacs/tree/v2026.3/docs"},"inventory_format":"official-document-source-catalog-1.1","inventory_scope":"upstream-universe","method":"manual-inventory","processor":{"assurance_mode":"unverified","attestation_id":null,"configuration_ref":null,"dependency_lock_ref":null,"deterministic":true,"implementation_ref":null,"input_sha256":"10e748c7da6a95637d350c023e906e20ab51074a1211cde5f75cac42d36afb43","output_sha256":"b83e742ff2c8798953575e0760405139909cb25536c0665db25a79f6921dd15e","processor_id":"official-document-pack-enumerator","processor_version":"1.0"},"upstream_universe_complete":true},"limitations":["External raw identity is the SHA-256 of canonical sorted git ls-tree -r receipt lines '<mode> <object_type> <object_id>\\t<path>\\n' for every inventory entry; the local inventory JSON is metadata evidence only and contains no official document body bytes.","Inventory and source identities are projected as technical artifacts only.","The exact 2026.3 docs tree is inventoried as metadata only; source bodies, generated online help, native binary help, force fields, and regression data remain external.","The exact documentation-tree inventory does not establish installed binary identity, build features, force-field provenance, native behavior, sampling convergence, or scientific acceptance.","The inventory identity binds the exact pre-migration catalog bytes as migration metadata; it does not identify any upstream document body."],"producer":{"generated_utc":"2026-07-24T00:00:00Z","skill_id":"gromacs-rigorous-simulations","skill_version":"1.0","tool_id":"official-document-pack-builder","tool_version":"1.0"},"provider_id":"gromacs","schema_version":"1.1","source_inventory":{"gromacs-exact-document-tree-inventory":{"disposition":"included","loss_ids":["binary-help-and-build-closure-missing","document-bodies-not-retained","generated-command-and-mdp-reference-not-replayed"],"source_identity":{"content_mode":"external-content","locator":"https://github.com/gromacs/gromacs/tree/v2026.3/docs","receipt":{"raw_bytes":57199,"raw_sha256":"efaa463a8dfb749f445f7d6bb7de73704bc959a16215984792fe72ae7f94baa9","retrieval_method":"git-object","retrieved_utc":"2026-07-23T20:17:38Z"}},"source_kind":"index","subject_ids":["index.1-complete-command-index","index.2-global-wrapper-and-build-identity","command.gmx-version","command.gmx-help-commands","command.gmx-pdb2gmx","command.gmx-editconf","command.gmx-solvate","command.gmx-genion","command.gmx-insert-molecules","command.gmx-make-ndx","command.gmx-select","command.gmx-grompp","command.gmx-mdrun","command.gmx-convert-tpr","command.gmx-check","command.gmx-dump","command.gmx-report-methods","command.gmx-trjconv","command.gmx-trjcat","command.gmx-convert-trj","command.gmx-eneconv","command.gmx-energy","command.gmx-rms","command.gmx-rmsf","command.gmx-gyrate","command.gmx-hbond","command.gmx-distance","command.gmx-angle","command.gmx-rdf","command.gmx-msd","command.gmx-velacc","command.gmx-density","command.gmx-sasa","command.gmx-covar","command.gmx-anaeig","command.gmx-wham","command.gmx-bar","command.gmx-analyze","command.gmx-tune-pme","recipe.build-pinned-source-cmake","recipe.inspect-binary","recipe.prepare-biomolecular-system","recipe.preprocess-new-segment","recipe.preprocess-checkpoint-continuation","recipe.energy-minimization","recipe.nvt-equilibration","recipe.npt-equilibration","recipe.production-md","recipe.continue-from-checkpoint","recipe.extend-run-input","recipe.check-native-artifacts","recipe.inspect-run-input-and-checkpoint","recipe.extract-energy-series","recipe.trajectory-pbc-view","recipe.spatial-density-profile","recipe.rmsd-analysis","recipe.rdf-analysis","recipe.msd-analysis"],"title":"GROMACS 2026.3 complete documentation-tree metadata inventory"}},"status":"blocked","version_scope":{"kind":"exact","retrieved_utc":null,"snapshot_identity":null,"value":"2026.3"}}
