{"authority_id":"pymatgen-release-source-docs-2026-5-4","blockers":[{"code":"doc.body.bytes.external","description":"Official document bodies and per-page content hashes are not retained, so provider-required subjects remain blocked.","dimension":"inventory"}],"contract_name":"official-corpus-manifest","corpus_id":"dft-structure-preparation-pymatgen-docs-official-corpus","discovery":{"authority_revision":"27f535f1139df67dff9a5aedc984cab5d5e06e6bc9159e5ca0e0363e62f0021b","authority_root":"https://github.com/materialsproject/pymatgen/tree/","inventory":{"content_mode":"metadata-only","identity":{"bytes":6498,"sha256":"27f535f1139df67dff9a5aedc984cab5d5e06e6bc9159e5ca0e0363e62f0021b"},"locator":"https://github.com/materialsproject/pymatgen/tree/v2026.5.4"},"inventory_format":"official-document-source-catalog-1.1","inventory_scope":"upstream-universe","method":"manual-inventory","processor":{"assurance_mode":"unverified","attestation_id":null,"configuration_ref":null,"dependency_lock_ref":null,"deterministic":true,"implementation_ref":null,"input_sha256":"27f535f1139df67dff9a5aedc984cab5d5e06e6bc9159e5ca0e0363e62f0021b","output_sha256":"8775980821d83e0f44cb23c86d7c62db24e160a94c90d181696b1a04488a675c","processor_id":"official-document-pack-enumerator","processor_version":"1.0"},"upstream_universe_complete":true},"limitations":["Exact release Git-tree path and object identities are retained without official document bodies or generated rendered pages.","External raw identity is the SHA-256 of canonical sorted git ls-tree -r receipt lines '<mode> <object_type> <object_id>\\t<path>\\n' for every inventory entry; the local inventory JSON is metadata evidence only and contains no official document body bytes.","Inventory and source identities are projected as technical artifacts only.","The inventory identity binds the exact pre-migration catalog bytes as migration metadata; it does not identify any upstream document body.","This metadata inventory proves the bounded exact tree and path universe only; it does not prove rendered documentation completeness or provider behavior."],"producer":{"generated_utc":"2026-07-24T00:00:00Z","skill_id":"dft-structure-preparation","skill_version":"1.0","tool_id":"official-document-pack-builder","tool_version":"1.0"},"provider_id":"pymatgen","schema_version":"1.1","source_inventory":{"pymatgen-exact-document-tree-inventory":{"disposition":"included","loss_ids":["document-bodies-not-retained","rendered-build-not-replayed"],"source_identity":{"content_mode":"external-content","locator":"https://github.com/materialsproject/pymatgen/tree/v2026.5.4","receipt":{"raw_bytes":5854,"raw_sha256":"bada5300c04a6472ac57507bec7ec166b0f1c336dc754b203bead0ea7251769e","retrieval_method":"git-object","retrieved_utc":"2026-07-23T20:17:38Z"}},"source_kind":"index","subject_ids":["pymatgen-structure-io","pymatgen-ase-adaptor","pymatgen-standardization","pymatgen-general-supercell","pymatgen-slab-adsorbate","pymatgen-core-manual-vacancy","pymatgen-molecule-box"],"title":"Exact release documentation-tree metadata inventory"}},"status":"blocked","version_scope":{"kind":"exact","retrieved_utc":null,"snapshot_identity":null,"value":"2026.5.4"}}
