{"authority_id":"qe-official-docs","blockers":[],"contract_name":"official-corpus-manifest","corpus_id":"dft-postprocess-qe-7-5-postprocess-official-corpus","discovery":{"authority_revision":"3a96d4ba65bd5c197eab332441d0e7e5d2cdf563909cb715a3a36036454cf6d8","authority_root":"https://www.quantum-espresso.org/Doc/","inventory":{"content_mode":"metadata-only","identity":{"bytes":8061,"sha256":"3a96d4ba65bd5c197eab332441d0e7e5d2cdf563909cb715a3a36036454cf6d8"},"locator":"https://www.quantum-espresso.org/Doc/INPUT_BANDS.txt"},"inventory_format":"official-document-source-catalog-1.1","inventory_scope":"bounded-authority-subset","method":"manual-inventory","processor":{"assurance_mode":"unverified","attestation_id":null,"configuration_ref":null,"dependency_lock_ref":null,"deterministic":true,"implementation_ref":null,"input_sha256":"3a96d4ba65bd5c197eab332441d0e7e5d2cdf563909cb715a3a36036454cf6d8","output_sha256":"761fdc537112c9358d1dc87b8ac1ee014da8bec50fc58c8669c8465dd6e53198","processor_id":"official-document-pack-enumerator","processor_version":"1.0"},"upstream_universe_complete":false},"limitations":["Inventory and source identities are projected as technical artifacts only.","Route maturity is copied exactly from the canonical observable registry and is never raised.","The inventory identity binds the exact pre-migration catalog bytes as migration metadata; it does not identify any upstream document body.","The pack stores metadata and receipts only and does not embed provider text.","The selected pages are version-labeled but the official web corpus remains rolling and incomplete."],"producer":{"generated_utc":"2026-07-24T00:00:00Z","skill_id":"dft-postprocess","skill_version":"1.0","tool_id":"official-document-pack-builder","tool_version":"1.0"},"provider_id":"qe","schema_version":"1.1","source_inventory":{"qe-input-bands":{"disposition":"included","loss_ids":[],"source_identity":{"content_mode":"external-content","locator":"https://www.quantum-espresso.org/Doc/INPUT_BANDS.txt","receipt":{"raw_bytes":6604,"raw_sha256":"b8b1193c4f2723310151d7825240f9b20fe2212d1e0f509cce89988a93f7a14a","retrieval_method":"https-get","retrieved_utc":"2026-07-17T11:49:00Z"}},"source_kind":"reference-page","subject_ids":["qe-bands-artifacts"],"title":"QE 7.5 INPUT_BANDS"},"qe-input-dos":{"disposition":"included","loss_ids":[],"source_identity":{"content_mode":"external-content","locator":"https://www.quantum-espresso.org/Doc/INPUT_DOS.txt","receipt":{"raw_bytes":5896,"raw_sha256":"d18fa270d3ca41b3bed586c40bb9cf5fb2b67962e741381a75bea23b6601eff3","retrieval_method":"https-get","retrieved_utc":"2026-07-17T11:49:00Z"}},"source_kind":"reference-page","subject_ids":["qe-dos-projection-artifacts"],"title":"QE 7.5 INPUT_DOS"},"qe-input-dynmat":{"disposition":"included","loss_ids":[],"source_identity":{"content_mode":"external-content","locator":"https://www.quantum-espresso.org/Doc/INPUT_DYNMAT.txt","receipt":{"raw_bytes":8143,"raw_sha256":"4da654f7ed8ec6ceb5d38a4e470389b2fb414999eb5233e083ea454c2669470e","retrieval_method":"https-get","retrieved_utc":"2026-07-17T11:49:00Z"}},"source_kind":"reference-page","subject_ids":["qe-phonon-epc-artifacts"],"title":"QE 7.5 INPUT_DYNMAT"},"qe-input-matdyn":{"disposition":"included","loss_ids":[],"source_identity":{"content_mode":"external-content","locator":"https://www.quantum-espresso.org/Doc/INPUT_MATDYN.txt","receipt":{"raw_bytes":20467,"raw_sha256":"e162a380590814b4ce7bce383261cbcae2567f7e9c21de8655af446082691b91","retrieval_method":"https-get","retrieved_utc":"2026-07-17T11:49:00Z"}},"source_kind":"reference-page","subject_ids":["qe-phonon-epc-artifacts"],"title":"QE 7.5 INPUT_MATDYN"},"qe-input-pp":{"disposition":"included","loss_ids":[],"source_identity":{"content_mode":"external-content","locator":"https://www.quantum-espresso.org/Doc/INPUT_PP.html","receipt":{"raw_bytes":57125,"raw_sha256":"482dc70016a4638b18eca0219e56754e09fa195524a55decd6df3e6fbc5efd1c","retrieval_method":"https-get","retrieved_utc":"2026-07-17T11:49:00Z"}},"source_kind":"reference-page","subject_ids":["qe-grid-artifacts"],"title":"QE 7.5 INPUT_PP"},"qe-input-projwfc":{"disposition":"included","loss_ids":[],"source_identity":{"content_mode":"external-content","locator":"https://www.quantum-espresso.org/Doc/INPUT_PROJWFC.txt","receipt":{"raw_bytes":14081,"raw_sha256":"2fe26603465c910cec30dd5da42fb157e6e9135b8d099e01130833232df8c01c","retrieval_method":"https-get","retrieved_utc":"2026-07-17T11:49:00Z"}},"source_kind":"reference-page","subject_ids":["qe-dos-projection-artifacts"],"title":"QE 7.5 INPUT_PROJWFC"},"qe-input-q2r":{"disposition":"included","loss_ids":[],"source_identity":{"content_mode":"external-content","locator":"https://www.quantum-espresso.org/Doc/INPUT_Q2R.txt","receipt":{"raw_bytes":7356,"raw_sha256":"d493ae0332d60c865e904223a7db8a6b426570c1a07032946e186c869d5ca4ea","retrieval_method":"https-get","retrieved_utc":"2026-07-17T11:49:00Z"}},"source_kind":"reference-page","subject_ids":["qe-phonon-epc-artifacts"],"title":"QE 7.5 INPUT_Q2R"}},"status":"partial","version_scope":{"kind":"exact","retrieved_utc":null,"snapshot_identity":null,"value":"7.5"}}
