{"authority_id":"gaussian-g16-c02-release-materials","blockers":[],"contract_name":"official-corpus-manifest","corpus_id":"gaussian-rigorous-calculations-gaussian-g16-c02-delta-official-corpus","discovery":{"authority_revision":"7a86a8304545d97684f92b5687b33dfa8e8bd8f49ea7c74e9b7baef9dce5fad9","authority_root":"https://gaussian.com/wp-json/wp/v2/pages/","inventory":{"content_mode":"metadata-only","identity":{"bytes":5990,"sha256":"7a86a8304545d97684f92b5687b33dfa8e8bd8f49ea7c74e9b7baef9dce5fad9"},"locator":"https://gaussian.com/wp-json/wp/v2/pages/15586"},"inventory_format":"official-document-source-catalog-1.1","inventory_scope":"bounded-authority-subset","method":"manual-inventory","processor":{"assurance_mode":"unverified","attestation_id":null,"configuration_ref":null,"dependency_lock_ref":null,"deterministic":true,"implementation_ref":null,"input_sha256":"7a86a8304545d97684f92b5687b33dfa8e8bd8f49ea7c74e9b7baef9dce5fad9","output_sha256":"a4801ba4e549f0b7c12c52bb839e95395c0cae04a6bfbe2b5982ddc8670d1e78","processor_id":"official-document-pack-enumerator","processor_version":"1.0"},"upstream_universe_complete":false},"limitations":["C.02 release materials are a delta and do not make the C.01 public user reference version-matched C.02 documentation.","Coverage is metadata-only and bounded to five public Gaussian 16 Rev. C.01 WordPress page records plus the public Rev. C.02 release-note record and platform PDF.","Inventory and source identities are projected as technical artifacts only.","No private manual, installer, binary, example, basis payload, or checkpoint is stored.","Private manuals, examples, binaries, basis payloads, checkpoints, user data, calculation artifacts, execution authorization, convergence, and scientific acceptance remain outside this pack.","Selector 'g16-c02-release-notes-content' for source 'g16-c02-release-notes' uses non-whole external projection and cannot claim exact upstream bytes.","Selector kind json-pointer is retained; no virtual selector body bytes are introduced by migration.","The C.01 keyword, IOp, utility, option, and user-reference leaf graph is not completely enumerated or receipt-bound.","The C.02 materials are a release delta and cannot establish a complete version-matched C.02 reference.","The inventory identity binds the exact pre-migration catalog bytes as migration metadata; it does not identify any upstream document body."],"producer":{"generated_utc":"2026-07-24T00:00:00Z","skill_id":"gaussian-rigorous-calculations","skill_version":"1.0","tool_id":"official-document-pack-builder","tool_version":"1.0"},"provider_id":"gaussian","schema_version":"1.1","source_inventory":{"g16-c01-users-reference-excluded-from-c02":{"disposition":"excluded","rationale":"The public Users Reference identifies itself as G16 Rev. C.01 and cannot be silently promoted into the C.02 delta corpus.","reason_code":"out-of-scope","source_identity":{"content_mode":"excluded","inventory_entry_identity":{"bytes":266,"sha256":"5c6199815763dc9586b122c6e7b3ed69d140b3b301531761efd1d39090a8b099"},"locator":"https://gaussian.com/man/"},"source_kind":"other","title":"Gaussian 16 C.01 Users Reference"},"g16-c02-platform-list":{"disposition":"included","loss_ids":["g16-c02-no-complete-reference"],"source_identity":{"content_mode":"external-content","locator":"https://gaussian.com/g16/g16_plat.pdf","receipt":{"raw_bytes":237846,"raw_sha256":"d19685abcb3eba25cd175c228bcd29546f1940e052a4ab3820ffa8c804352b08","retrieval_method":"https-get","retrieved_utc":"2026-07-23T19:36:48Z"}},"source_kind":"pdf","subject_ids":["g16-c02-platform-profile"],"title":"Gaussian 16 Available Binary Versions for Rev. C.01 and C.02"},"g16-c02-release-notes":{"disposition":"included","loss_ids":["g16-c02-no-complete-reference"],"source_identity":{"content_mode":"external-content","locator":"https://gaussian.com/wp-json/wp/v2/pages/15586","receipt":{"raw_bytes":75818,"raw_sha256":"ac8ffd81d51e2d8031eb55a146682d91dbc490eebf05081ad19a26302d759ea6","retrieval_method":"official-api","retrieved_utc":"2026-07-23T19:38:20Z"}},"source_kind":"release-note","subject_ids":["g16-c02-release-delta"],"title":"Gaussian 16 Rev. C.01/C.02 Release Notes"}},"status":"partial","version_scope":{"kind":"exact","retrieved_utc":null,"snapshot_identity":null,"value":"16-C.02-release-delta"}}
